appid,query,query_group,query_priority,provider,tavily_search_depth,budget_query_number,url,title,snippet,date_classification,evidence_type
3595450,"""Object Impermanence"" Steam",general,1,tavily,basic,1,https://steamcommunity.com/app/3595450,Object Impermanence - Steam Community,"Object Impermanence - A first person puzzle game where your vision defines reality, and only the things you can see exist.",unknown_date,web_result
3595450,"""Object Impermanence"" Steam",general,1,tavily,basic,1,https://steamcommunity.com/app/3595450/discussions,Object Impermanence General Discussions :: Steam Community,"Object Impermanence - A first person puzzle game where your vision defines reality, and only the things you can see exist. Learn and master the strange",unknown_date,web_result
3595450,"""Object Impermanence"" Steam",general,1,tavily,basic,1,https://steamcommunity.com/app/3595450/positivereviews,Object Impermanence - Steam Community,"Object Impermanence - A first person puzzle game where your vision defines reality, and only the things you can see exist. Learn and master the strange",unknown_date,web_result
3595450,"""Object Impermanence"" Steam",general,1,tavily,basic,1,https://store.steampowered.com/app/3595450/Object_Impermanence,Object Impermanence on Steam,"A first person puzzle game where your vision defines reality, and only the things you can see exist. Learn and master the strange behaviours of objects",unknown_date,web_result
3595450,"""Object Impermanence"" Steam",general,1,tavily,basic,1,https://80.lv/articles/check-out-this-wip-puzzle-game-where-objects-disappear-when-not-seen,Check Out Unity Puzzle Game Where Objects Disappear When Not ...,Object Impermanence is set to launch in Q1 2026. Have an early look at the gameplay shared by the devs: Wishlist on Steam and don't forget to,unknown_date,web_result
3595450,"""Object Impermanence"" trailer",general,1,tavily,basic,2,https://www.youtube.com/watch?v=whS602D7EkU,Object Permanence | Official Trailer,"Object Permanence, the full film, officially premieres publicly on this channel as soon as it hits the 100 subscribers mark.",unknown_date,web_result
3595450,"""Object Impermanence"" trailer",general,1,tavily,basic,2,https://www.reddit.com/r/gaming/comments/1npi0lg/object_impermanence_reveal_trailer,Object Impermanence - Reveal Trailer : r/gaming,Very interesting ideas. I really liked some of them. Passing through the grate backwards or turning away from the tram was really cool.,unknown_date,reddit_discussion
3595450,"""Object Impermanence"" trailer",general,1,tavily,basic,2,https://store.steampowered.com/app/3595450/Object_Impermanence,Object Impermanence on Steam,"A first person puzzle game where your vision defines reality, and only the things you can see exist. Learn and master the strange behaviours of objects",unknown_date,web_result
3595450,"""Object Impermanence"" trailer",general,1,tavily,basic,2,https://vimeo.com/527612074,"Object Permanence, Stella Brennan, 2018 low res.mp4","This is ""Object Permanence, Stella Brennan, 2018 low res.mp4"" by Stella Brennan on Vimeo, the home for high quality videos and the people",unknown_date,web_result
3595450,"""Object Impermanence"" trailer",general,1,tavily,basic,2,https://www.nowness.com/story/object-permanence-mark-romanek,Object Permanence,Mark Romanek investigates AI image-making in a surreal short film shaped by the unpredictability of the process.,unknown_date,web_result
3595450,"""Object Impermanence"" gameplay",general,1,tavily,basic,3,https://www.youtube.com/watch?v=eAvLqalgRrM,Object Impermanence - Playthrough,Object Impermanence is a VR dungeon crawler utilizing Non-Euclidean Geometry tricks and puzzles. You explore a dungeon full of mysterious,unknown_date,web_result
3595450,"""Object Impermanence"" gameplay",general,1,tavily,basic,3,https://kotaku.com/games/object-impermanence,Object Impermanence,"A first person puzzle game where your vision defines reality, and only the things you can see exist. Learn and master the strange behaviours of objects",unknown_date,web_result
3595450,"""Object Impermanence"" gameplay",general,1,tavily,basic,3,https://skymavisgann.itch.io/object-impermanence,Object Impermanence by Sky,You explore a dungeon full of mysterious and weird artifacts which you can sell to buy weapons and tools. But beware there are creatures that lurk in the dark.,unknown_date,web_result
3595450,"""Object Impermanence"" gameplay",general,1,tavily,basic,3,https://www.reddit.com/r/TwoBestFriendsPlay/comments/1npq8we/object_impermanence_a_firstperson_puzzle_game,Object Impermanence - A first-person puzzle game where ...,Object Impermanence - A first-person puzzle game where objects lose their physical properties when you look away from them. Trailer.,unknown_date,reddit_discussion
3595450,"""Object Impermanence"" gameplay",general,1,tavily,basic,3,https://www.youtube.com/watch?v=SY-cHo8h-jE,【Object Impermanence Playtest】What Do You Mean That's ...,【Object Impermanence Playtest】What Do You Mean That's Not How It Normally Works?​ · Comments.,unknown_date,web_result
3595450,"""Object Impermanence"" demo",general,1,tavily,basic,4,https://helpfulprofessor.com/object-permanence-examples,10 Object Permanence Examples (2026) - Helpful Professor,One very popular demonstration of object permanence involves a toy and a blanket. First place the baby on the floor about 3 feet in front of you.,unknown_date,web_result
3595450,"""Object Impermanence"" demo",general,1,tavily,basic,4,https://steamcommunity.com/app/3595450,Object Impermanence - Steam Community,Learn and master the strange behaviours of objects outside your vision. Traverse the ancient structures of a world forgotten by the universe.,unknown_date,web_result
3595450,"""Object Impermanence"" demo",general,1,tavily,basic,4,https://medium.com/publishous/oops-i-did-it-again-object-impermanence-dopamine-seeking-a91cae1952a8,"Oops, I Did It Again: Object Impermanence & Dopamine-Seeking","True object impermanence means we don't know something exists when we can't see it. This is a normal part of infancy, and we later develop",unknown_date,web_result
3595450,"""Object Impermanence"" demo",general,1,tavily,basic,4,https://www.youtube.com/watch?v=RwcflYiuw5s,Object Impermanence in ADHD (EXPLAINED SIMPLY!) - YouTube,"... object permanence and struggle to remember that an object exists once it is out of sight. In this video, we explain what object impermanence",unknown_date,web_result
3595450,"""Object Impermanence"" demo",general,1,tavily,basic,4,https://vimeo.com/363467974,Object Impermanence video on Vimeo,I wanted to have some fun with this project so i chose to only show the shadows of what the figures did. Figures: myself and my sister.,unknown_date,web_result
3595450,"""Object Impermanence"" release date",general,1,tavily,basic,5,https://store.steampowered.com/app/3595450/Object_Impermanence,Object Impermanence on Steam,"Planned Release Date: Q3 2026 ; Title: Object Impermanence ; Genre: Adventure, Casual, Indie. Developer: Slugware. Publisher: Slugware ; Release Date: Q3 2026.",unknown_date,web_result
3595450,"""Object Impermanence"" release date",general,1,tavily,basic,5,https://isthereanydeal.com/game/object-impermanence/info,Prices - Object Impermanence,"Object Impermanence game info, prices from authorized stored. ... Release date: 31 Mar 2026. Developers: Slugware. Publishers: Slugware. Excluded",unknown_date,web_result
3595450,"""Object Impermanence"" release date",general,1,tavily,basic,5,https://steamdb.info/app/3595450,Object Impermanence,"... Object Impermanence Steam charts, data, update history ... Release Date, 2026. A first person puzzle game where your vision defines",unknown_date,web_result
3595450,"""Object Impermanence"" release date",general,1,tavily,basic,5,https://www.imdb.com/title/tt1971299,"""Weeds"" Object Impermanence (TV Episode 2011)","Details ; Release date · August 1, 2011 (United States) ; Filming locations · Universal Studios - 100 Universal City Plaza, Universal City, California, USA.",unknown_date,web_result
3595450,"""Object Impermanence"" release date",general,1,tavily,basic,5,https://www.tiktok.com/@slugwaregames/video/7603055459100036374,Object Impermanence: A Unique Puzzle Game Coming in ...,"Slated for release in 2026, this indie game introduces a unique concept where visibility defines existence. In this world, objects that are not",unknown_date,web_result
3595450,"""Object Impermanence"" announcement",general,1,tavily,basic,6,https://steamcommunity.com/app/3595450/eventcomments,Object Impermanence Events & Announcements :: Steam Community,"Object Impermanence ; 0. Feb 12 @ 11:39pm. The playtest has ended! ; 4. Feb 8 @ 4:38pm. First Playtest: Feb 5–8th ; 1. Nov 3, 2025 @ 9:48pm. 👁️Looking for",unknown_date,web_result
3595450,"""Object Impermanence"" announcement",general,1,tavily,basic,6,https://cici.berkeley.edu/news/now-august-21-object-impermanence-david-brower-center,Now - August 21 : Object [Im]Permanence (David Brower Center),"The Brower Center's 2025 annual local exhibition, Object [Im]Permanence, features five jury-selected Northern California artists challenging",unknown_date,web_result
3595450,"""Object Impermanence"" announcement",general,1,tavily,basic,6,https://x.com/SlugwareGames,Object Impermanence 👁️ (@SlugwareGames) / Posts / X - Twitter,Full steam news post: Object Impermanence - First Playtest: Feb 5–8th - Steam News.,unknown_date,web_result
3595450,"""Object Impermanence"" announcement",general,1,tavily,basic,6,https://www.instagram.com/p/DJ2SutaBXkK,available digitally via @ximgberlin. I'm beyond to be a part of X-IMG ...,"... OBJECT PERMANENCE” dropping May 25th, 2025 — available digitally ... NOW ANNOUNCING / my debut album “OBJECT PERMANENCE” dropping May",unknown_date,web_result
3595450,"""Object Impermanence"" announcement",general,1,tavily,basic,6,https://store.steampowered.com/app/3595450/Object_Impermanence,Object Impermanence on Steam,"A first person puzzle game where your vision defines reality, and only the things you can see exist. Learn and master the strange behaviours of objects",unknown_date,web_result
3595450,"""Object Impermanence"" preview",general,1,tavily,basic,7,https://www.youtube.com/watch?v=GZx88oenVQk,Object Impermanence | Reveal Trailer - YouTube,"Check out this unusual Unity-powered puzzle game, Object Impermanence, developed by Slugware, which plays with the idea that objects stop",unknown_date,web_result
3595450,"""Object Impermanence"" preview",general,1,tavily,basic,7,https://breeze-wellbeing.com/blog/adhd-object-permanence,"“Out of Sight, Out of Mind”: ADHD Object Permanence - Breeze Blog","# Object Permanence in ADHD Adults. “*Object permanence*” is a cognitive idea that might help you find your way through this fog. In simple terms, object permanence is the understanding that objects continue to exist even when they cannot be seen, heard, or otherwise sensed. This blog delves into how people with ADHD may struggle with object permanence, why it matters, and ways to strengthen their object permanence. ## What is object permanence? In psychology, the definition of object permanence refers to the understanding that objects continue to exist even when they cannot be seen, heard, or touched. In essence, object permanence allows us to hold onto the idea of something’s existence even when it’s not directly in front of us. In the case of people with ADHD, it’s not that you don’t have the understanding that something exists. This can contribute to the lack of object permanence, referred to as object impermanence, in ADHD adults.",unknown_date,web_result
3595450,"""Object Impermanence"" preview",general,1,tavily,basic,7,https://browercenter.org/exhibit/object-impermanence,Object [Im]Permanence - David Brower Center,"Northern California artists challenging structural norms of disposability. On view at the Brower Center through August 21, 2025.",unknown_date,web_result
3595450,"""Object Impermanence"" preview",general,1,tavily,basic,7,https://www.youtube.com/watch?v=JMEDPNvSqsU,object impermanence (Official Audio) - YouTube,About regret. ~ stream here ~ https://www.brycebishop.org/ ~ socials ~ https://linktree.com/brycebishop ~ lyrics ~ Tear me in two I can't be,unknown_date,web_result
3595450,"""Object Impermanence"" preview",general,1,tavily,basic,7,https://skymavisgann.itch.io/object-impermanence,Object Impermanence by Sky - Sky - itch.io,You explore a dungeon full of mysterious and weird artifacts which you can sell to buy weapons and tools. But beware there are creatures that lurk in the dark.,unknown_date,web_result
3595450,"""Object Impermanence"" review",general,1,tavily,basic,8,https://thenumberkevin.com/2016/11/14/review-scott-ryan-object-permanence,ALBUM REVIEW: Scott Ryan – Object Permanence,"Scott Ryan is a good surprise. His new EP, Object Permanence, carries a shape-shifting, retro sound that covers more ground in five songs than most LPs cover",unknown_date,web_result
3595450,"""Object Impermanence"" review",general,1,tavily,basic,8,https://illustratemagazine.com/object-permanence-by-eyas-review,Object Permanence by Eyas: Review - Illustrate Magazine,"The most recent single released by Eyas, titled “Object Permanence,” sheds light on the kind of love that is accompanied by confusion, anxiety, and heartache.",unknown_date,web_result
3595450,"""Object Impermanence"" review",general,1,tavily,basic,8,http://post-trash.com/news/2020/9/2/hooper-crescent-object-permanence-album-review,"Hooper Crescent - ""Object Permanence"" | Album Review","Object Permanence is a relentlessly rhythmic record, balancing any nervy guitar with an underlying catchiness.",unknown_date,web_result
3595450,"""Object Impermanence"" review",general,1,tavily,basic,8,https://www.bummerbrews.com/words/song-review-object-permanence-by-arms-length,Song Review: “Object Permanence” by Arm's Length - Bummer Brews,"Canadian band Arm's Length has released their newest single “Object Permanence,” and it's one of their best songs yet.",unknown_date,web_result
3595450,"""Object Impermanence"" review",general,1,tavily,basic,8,https://www.albumoftheyear.org/album/1119907-sophia-stel-object-permanence/user-reviews,Sophia Stel - Object Permanence - User Reviews - Album of The Year,"Fun quaint lil' true indie alt pop album with some quality sounding tracks. Nice synthy new gen tunes, and even a lil uk garage influence in the remixes.",unknown_date,web_result
3595450,"""Object Impermanence"" publisher",general,1,tavily,basic,9,https://www.amazon.com.be/-/en/Object-Impermanence-Weird-Fantastic-Stories/dp/B0BMJHDLF5,"Object Impermanence: Weird and Fantastic Stories : Bayne, Margery","Publisher, Independently published. Publication date, 17 Nov. 2022. Language, ‎English. Print length, 68 pages. ISBN-13, 979-8361708529. Item weight, ‎104 g.",unknown_date,web_result
3595450,"""Object Impermanence"" publisher",general,1,tavily,basic,9,https://poems.com/poem/object-permanence-2,Object Permanence – Poetry Daily,"“Object Permanence” from PLEASURE PRINCIPLE: by Madeleine Cravens. Published by Scribner on June 4, 2024. Copyright © 2024 by Madeleine Cravens.",unknown_date,web_result
3595450,"""Object Impermanence"" publisher",general,1,tavily,basic,9,https://www.ebay.com/itm/198015085132?chn=ps&mkevt=1&mkcid=28&google_free_listing_action=view_item,Object Permanence | eBay,"Object Permanence ; ISBN10: 1800462751 ; Author: Harder, Christopher (Author) ; Binding: Paperback, Paperback ; Publisher: Troubador Publishing ; Publication Date:",unknown_date,web_result
3595450,"""Object Impermanence"" publisher",general,1,tavily,basic,9,https://karger.com/Article/Abstract/278425,The Object Permanence Fallacy - Abstract - Karger Publishers,"By claiming that young infants lacking representation treat absent objects as if they were destroyed or 'impermanent', Piaget created the",unknown_date,web_result
3595450,"""Object Impermanence"" publisher",general,1,tavily,basic,9,https://medium.com/publishous/oops-i-did-it-again-object-impermanence-dopamine-seeking-a91cae1952a8,"Oops, I Did It Again: Object Impermanence & Dopamine-Seeking","True object impermanence means we don't know something exists when we can't see it. This is a normal part of infancy, and we later develop",unknown_date,web_result
3595450,"""Object Impermanence"" developer",general,1,tavily,basic,10,https://napacenter.org/object-permanence,3 Activities to Help Develop Object Permanence Skills - NAPA Center,"In this blog, NAPA pediatric therapists discuss object permanence, potential links to ADHD, and activities to help develop the skill.",unknown_date,web_result
3595450,"""Object Impermanence"" developer",general,1,tavily,basic,10,https://store.steampowered.com/app/3595450/Object_Impermanence,Object Impermanence on Steam,"Get the Steam Mobile App. All trademarks are property of their respective owners in the US and other countries. Link to the Steam Homepage. A first person puzzle game where your vision defines reality, and only the things you can see exist. Sign in to add this item to your wishlist, follow it, or mark it as ignored. Steam is learning about this game. With your vessel unable to carry you home, the ruins ahead call to you, their doors opening only to those who see the patterns of the decayed reality, and who learn to use them to their advantage.*. To progress you need to interact with the old machines across the ruins, and the world around you, but the decaying reality makes them behave in strange ways when you look away. You can use this widget-maker to generate a bit of HTML that can be embedded in your website to easily allow customers to purchase this game on Steam.",unknown_date,web_result
3595450,"""Object Impermanence"" developer",general,1,tavily,basic,10,https://skymavisgann.itch.io/object-impermanence,Object Impermanence by Sky - Sky - itch.io,In order to leave the dungeon alive you'll have to find the final boss and defeat him. Credits: Made by Sky Gann as Developer and Charlie Major as Artist and Co,unknown_date,web_result
3595450,"""Object Impermanence"" developer",general,1,tavily,basic,10,https://www.webmd.com/baby/what-age-do-babies-have-object-permanence,"Object Permanence: What It Is, Importance & How You Can Help","# Object Permanence: How Do Babies Learn It? Your baby is learning that people and objects exist even when they can’t see or hear them. Object permanence is one of the milestones in development that your infant will learn during their first year of life. Your baby learns object permanence when they figure out that people and objects still exist even if you can't see or hear them. Object permanence means that you know an object or person still exists even when they are hidden and you can’t see or hear them. Before your baby develops object permanence, they seem to believe that things that leave their sight are gone and don’t exist anymore. Once they start to learn object permanence, they will begin to look for the toy they lost or seem unhappy that they don’t have it. As your baby learns you're still there even when they can't see you, they will giggle when they see you again.",unknown_date,web_result
3595450,"""Object Impermanence"" developer",general,1,tavily,basic,10,https://en.wikipedia.org/wiki/Object_permanence,Object permanence - Wikipedia,"# Object permanence. **Object permanence** is the understanding that whether an object can be sensed has no effect on whether it continues to exist. This is a fundamental concept studied in the field of developmental psychology, the subfield of psychology that addresses the development of young children's social and mental capacities. There is not yet scientific consensus on when the understanding of object permanence emerges in human development. Jean Piaget, the Swiss psychologist who first studied object permanence in infants, argued that it is one of an infant's most important accomplishments, as, without this concept, objects would have no separate, permanent existence. In Piaget's theory of cognitive development, infants develop this understanding by the end of the ""sensorimotor stage"", which lasts from birth to about two years of age. Piaget thought that an infant's perception and understanding of the world depended on their motor development, which was required for the infant to link visual, tactile and motor representations of objects.",unknown_date,web_result
3595450,"site:reddit.com ""Object Impermanence""",social,3,tavily,basic,11,https://www.reddit.com/r/ADHD/comments/1lox639/object_impermanence,Object impermanence : r/ADHD - Reddit,Please be aware that that object permanence is the understanding that something continues to exist even if you aren't looking at it. It's part,unknown_date,reddit_discussion
3595450,"site:reddit.com ""Object Impermanence""",social,3,tavily,basic,11,https://www.reddit.com/r/ADHD/comments/1qg89b5/object_impermanence_goofs,Object Impermanence Goofs : r/ADHD - Reddit,Please be aware that that object permanence is the understanding that something continues to exist even if you aren't looking at it. It's part,unknown_date,reddit_discussion
3595450,"site:reddit.com ""Object Impermanence""",social,3,tavily,basic,11,https://www.reddit.com/r/ADHD/comments/1svqdbi/object_impermanence_can_make_relationships_feel,“Object impermanence” can make relationships feel so difficult ...,Object impermanence is when you take a babys toy and put it behind the couch and in their mind the toy doesn't actually exist anymore. It's why,unknown_date,reddit_discussion
3595450,"site:reddit.com ""Object Impermanence""",social,3,tavily,basic,11,https://www.reddit.com/r/adhdwomen/comments/rtlpg2/object_impermanence,object impermanence : r/adhdwomen - Reddit,"Also known as ""out of sight, out of mind"". Put things away in a cabinet or storage box and you forget you have them. This is why ADHD sufferers",unknown_date,reddit_discussion
3595450,"site:reddit.com ""Object Impermanence""",social,3,tavily,basic,11,https://www.reddit.com/r/adhdwomen/comments/1pan0ma/object_impermanence,Object impermanence : r/adhdwomen - Reddit,"Object impermanence. Rant/Vent. So, I have bought quite a few items ... Anyone else think the object impermanence thing makes you a bit clumsy?",unknown_date,reddit_discussion
3595450,"site:tiktok.com ""Object Impermanence""",social,4,tavily,basic,12,https://www.tiktok.com/discover/object-impermanence-with-relationships,Object Impermanence with Relationships | TikTok,Explore the concept of object impermanence in relationships and its impact on emotional bonds. Understand ADHD's role in relationship dynamics.,unknown_date,social_post
3595450,"site:tiktok.com ""Object Impermanence""",social,4,tavily,basic,12,https://www.tiktok.com/@selfexperimenting/video/7542653553538649358,Understanding Object Impermanence in ADHD and Autism - TikTok,"2147 Likes, 64 Comments. TikTok video from Self Experimenting (@selfexperimenting): “Explore how object permanence affects self-perception",unknown_date,social_post
3595450,"site:tiktok.com ""Object Impermanence""",social,4,tavily,basic,12,https://www.tiktok.com/@ave.ballz/video/7483635871363681567,Understanding Object Impermanence in Gaming | TikTok,"320 Likes, TikTok video from aveballz (@ave.ballz): “Explore the concept of object impermanence and its impact on gaming experiences.",unknown_date,social_post
3595450,"site:tiktok.com ""Object Impermanence""",social,4,tavily,basic,12,https://www.tiktok.com/@toren_wolf/video/7521078978786987278,Object Impermanence in Autism and ADHD Life - TikTok,"7273 Likes, 541 Comments. TikTok video from Toren_Wolf (@toren_wolf): “Explore the concept of object impermanence through the lens of autism",unknown_date,social_post
3595450,"site:tiktok.com ""Object Impermanence""",social,4,tavily,basic,12,https://www.tiktok.com/@anam.zweni/photo/7613681880130489620,Exploring Object Impermanence in Isixhosa Culture - TikTok,Dive into the significance of object impermanence in Isixhosa culture and its impact on societal values. #substack #substackwriter ... This is an,unknown_date,social_post
3595450,"site:instagram.com ""Object Impermanence""",social,4,tavily,basic,13,https://www.instagram.com/reel/DQW420ACUVK,Object Permanence? More like Object Impermanence! - Instagram,Object permanence is the ILLUSIVE understanding that objects and people continue to exist even when they are out of sight. Quantum physics,unknown_date,social_post
3595450,"site:instagram.com ""Object Impermanence""",social,4,tavily,basic,13,https://www.instagram.com/p/DTqvlDUCDhm,Object Impermanence     - Instagram,"For someone who can take centre stage, I do a lot of people watching. Thought a lot of things were all love till I really clocked it.",unknown_date,social_post
3595450,"site:instagram.com ""Object Impermanence""",social,4,tavily,basic,13,https://www.instagram.com/reel/DY52RVCjEPx,"Indie Sci-Fi puzzle adventure game, Object Impermanence, where ...","247K likes, 1029 comments - alpha_beta_gamer on May 28, 2026: ""Indie Sci-Fi puzzle adventure game, Object Impermanence, where things only",unknown_date,social_post
3595450,"site:instagram.com ""Object Impermanence""",social,4,tavily,basic,13,https://www.instagram.com/p/DXbc35MlC3u?img_index=4,'Objects of Impermanence' - Part 2 - Instagram,"Not everything I shoot is a grand landscape. Texture, detail, the abstract qualities hiding in ordinary surfaces — these pull at me just as",unknown_date,social_post
3595450,"site:instagram.com ""Object Impermanence""",social,4,tavily,basic,13,https://www.instagram.com/p/DY5857tp60s,// object impermanence - Instagram,"am limited Nothingis quite certain. this life and my fate after death. |amnot ""somebody"" with special power, ability, significance that",unknown_date,social_post
