appid,query,query_group,query_priority,provider,tavily_search_depth,budget_query_number,url,title,snippet,date_classification,evidence_type
3595450,"site:x.com ""Object Impermanence""",social,4,tavily,basic,14,https://x.com/SlugwareGames,Object Impermanence 👁️ (@SlugwareGames) / Posts / X - Twitter,"OBJECT IMPERMANENCE is a puzzle game where what you see defines reality: the things you can't see no longer move, remain or exist. releasing",unknown_date,social_post
3595450,"site:x.com ""Object Impermanence""",social,4,tavily,basic,14,https://x.com/elosociu,elosociu (@elosociu) / Posts / X - Twitter,"OBJECT IMPERMANENCE is a puzzle game where what you see defines reality: the things you can't see no longer move, remain or exist. releasing 2026! to wishlist",unknown_date,social_post
3595450,"site:x.com ""Object Impermanence""",social,4,tavily,basic,14,https://x.com/WitherStudios/with_replies,Wither Studios (@WitherStudios) / Posts and Replies / X,Object Impermanence 👁️ profile. Object Impermanence 👁️. SlugwareGames. Nov 3. our indie game: -you have no object permanence -control what,unknown_date,social_post
3595450,"site:x.com ""Object Impermanence""",social,4,tavily,basic,14,https://x.com/RamzZy_/status/2030016061001638154,You can't bread crumb someone with object impermanence & time ...,You can't bread crumb someone with object impermanence & time blindness - especially if they went to boarding school as a child.,unknown_date,social_post
3595450,"site:x.com ""Object Impermanence""",social,4,tavily,basic,14,https://x.com/Driftlens42/status/2007509851723968660,Scientific similarities between Shunyata (emptiness) and Anatta ...,Impermanence (anicca) and non-self (anattā) represent the reality that identity is not a stable object but an ongoing process. Modern research,unknown_date,social_post
3595450,"site: ""Object Impermanence""",social,4,tavily,basic,15,https://attncenter.nyc/object-permanence-and-adhd-the-out-of-sight-out-of-mind-phenomenon-explained,"Object Permanence & ADHD: “Out of Sight, Out of Mind” - 10018","# Object Permanence and ADHD: The “Out of Sight, Out of Mind” Phenomenon Explained. If you asked someone how their ADHD affects their daily life, many people would describe their difficulty remembering to complete tasks or their tendency to misplace objects. For example, someone with ADHD might be focused on brushing their teeth until they hear the phone ring in the other room. While a neurotypical person might blame such a mishap on one’s inherent forgetfulness, this scenario is actually related to a common ADHD symptom: problems with object permanence. Also known as the “out of sight, out of mind” phenomenon, object permanence deficits make it very difficult for people with ADHD to focus their attention on things that are not directly in front of them. Object permanence is the ability to understand that things, people, or situations continue to exist when they are not immediately visible to us. It’s not that people with ADHD are unable to *comprehend* that something exists when it is out of their field of view.",unknown_date,social_post
3595450,"site: ""Object Impermanence""",social,4,tavily,basic,15,https://www.thehowskills.com/blog/object-permanence-for-adhders,"Object Permanence and ADHD: How to Fix the ""Out of Sight, Out of ...","Object permanence is best defined as a phrase used to describe the ""out of sight, out of mind"" phenomenon, where something not immediately",unknown_date,social_post
3595450,"site: ""Object Impermanence""",social,4,tavily,basic,15,https://www.reddit.com/r/neurodiversity/comments/se541b/people_impermanence,People Impermanence? : r/neurodiversity - Reddit,"I know that object impermanence is, broadly speaking, out of sight out of mind, but I find myself stuggling with forgetting people way more than objects.",unknown_date,reddit_discussion
3595450,"site: ""Object Impermanence""",social,4,tavily,basic,15,https://ucfhealth.com/our-services/primary-care/object-permanence-adhd,Object Permanence in ADHD: 5 Strategies for Coping | Orlando | UCF Health,"# Object Permanence in ADHD: 5 Strategies for Coping. Welcome | UCF Health Faculty Physician Practice Services | Top Primary Care Physicians in Orlando | **Object Permanence in ADHD: 5 Strategies for Coping**. Adults and children who have ADHD sometimes lack the ability to understand object permanence. This article will take a deep dive into the concept of object permanence in individuals with ADHD, including an explanation of what it is and how it can impact daily life. The term object permanence, or object constancy, refers to the understanding that objects continue to exist even when they are not visible or perceptible. Most infants start to show object permanence around the same time, however, individuals who are neurodivergent (such as those with autism or ADHD) may have delays or differences in this developmental milestone. If you have a hard time staying on top of things because you have ADHD and issues with object permanence, it can lead to feelings of frustration, anxiety and even low self-esteem.",unknown_date,social_post
3595450,"site: ""Object Impermanence""",social,4,tavily,basic,15,https://www.medicalnewstoday.com/articles/object-permanence-adhd,Object permanence and ADHD: Definition and tips for coping,"Object permanence is the ability to understand that an object continues to exist, even though it is out of sight. It can affect people with ADHD",unknown_date,social_post
