appid,query,query_group,query_priority,provider,tavily_search_depth,budget_query_number,url,title,snippet,date_classification,evidence_type
3983860,"""Nightwater"" Steam",general,1,tavily,basic,1,https://steamcommunity.com/app/3983860,Nightwater - Steam Community,"Nightwater - Forage, craft and automate to grow your factory, unlock new technologies and expand your island to discover new biomes.",unknown_date,web_result
3983860,"""Nightwater"" Steam",general,1,tavily,basic,1,https://www.reddit.com/r/UnrealEngine5/comments/1rhxd4j/my_indie_game_nightwater_is_doing_its_first_steam,My indie game Nightwater is doing its first Steam playtest in 1 week ...,"In this playtest you can explore the first 2 biomes and try the first minigame, “Dark Thicket.” There's about 60–90 minutes of content to play",unknown_date,reddit_discussion
3983860,"""Nightwater"" Steam",general,1,tavily,basic,1,https://store.steampowered.com/app/3983860/Nightwater,Nightwater on Steam,"Forage, craft and automate to grow your factory, unlock new technologies and expand your island to discover new biomes. Progress through the ages from",unknown_date,web_result
3983860,"""Nightwater"" Steam",general,1,tavily,basic,1,https://store.steampowered.com/news/app/3983860/view/534376383746409090?snr=1_5_9_,Nightwater Official Playtest - Steam News,The first public playtest for Nightwater.,unknown_date,web_result
3983860,"""Nightwater"" Steam",general,1,tavily,basic,1,https://www.youtube.com/shorts/aI5te7gFSes,NIGHTWATER STEAM GAME - YouTube,Nightwater demo #1 MEJORANDO NUESTRA ISLA Y EVOLUCIONANDOLA. NIGHTWATER STEAM GAME. 3. 0. Share. Video unavailable.,unknown_date,web_result
3983860,"""Nightwater"" trailer",general,1,tavily,basic,2,https://www.youtube.com/watch?v=rZhZlZPZPvc,Nightwater - Official Announcement Trailer,"Take a look at the Announcement Trailer for Nightwater, a sandbox resource management game developed by Studio Ashty.",unknown_date,web_result
3983860,"""Nightwater"" trailer",general,1,tavily,basic,2,https://www.dailymotion.com/video/x9ycpaa,Nightwater Official Announcement Trailer - video Dailymotion,"Take a look at the Announcement Trailer for Nightwater, a sandbox resource management game developed by Studio Ashty.",unknown_date,web_result
3983860,"""Nightwater"" trailer",general,1,tavily,basic,2,https://www.dailymotion.com/video/x9xgg28,Nightwater Official Announcement Trailer - video Dailymotion,Watch Nightwater Official Announcement Trailer - Best Gaming TV on Dailymotion.,unknown_date,web_result
3983860,"""Nightwater"" trailer",general,1,tavily,basic,2,https://www.reddit.com/r/IndieGaming/comments/1q7irkq/just_announced_nightwater_a_game_inspired_by,"Just announced Nightwater, a game inspired by Forager ...","After 6 months of hard work, my game Nightwater is finally ready to be announced! The Steam page and announcement trailer are online.",unknown_date,reddit_discussion
3983860,"""Nightwater"" trailer",general,1,tavily,basic,2,https://store.steampowered.com/app/3983860/Nightwater,Nightwater on Steam,"Nightwater is a game about gathering, collecting, and managing resources. There are multiple unique biomes, each with its own resources and secrets to unveil.",unknown_date,web_result
3983860,"""Nightwater"" gameplay",general,1,tavily,basic,3,https://store.steampowered.com/app/3983860/Nightwater,Nightwater on Steam,"Nightwater is a game about gathering, collecting, and managing resources. There are multiple unique biomes, each with its own resources and secrets to unveil.",unknown_date,web_result
3983860,"""Nightwater"" gameplay",general,1,tavily,basic,3,https://www.gamingonlinux.com/2026/01/nightwater-looks-like-a-curious-blend-of-secrets-exploration-crafting-and-automation,Nightwater looks like a curious blend of secrets ...,"Nightwater is a game about gathering, collecting, and managing resources. There are multiple unique biomes, each with its own resources and",unknown_date,web_result
3983860,"""Nightwater"" gameplay",general,1,tavily,basic,3,https://steamcommunity.com/app/3983860,Nightwater,The game combines speedrunning with rewarding incremental elements to create an incredibly unique and addictive gameplay loop! The game is easy to,unknown_date,web_result
3983860,"""Nightwater"" gameplay",general,1,tavily,basic,3,https://www.reddit.com/r/UnrealEngine5/comments/1rhxd4j/my_indie_game_nightwater_is_doing_its_first_steam,My indie game Nightwater is doing its first Steam playtest in ...,"In this playtest you can explore the first 2 biomes and try the first minigame, “Dark Thicket.” There's about 60–90 minutes of content to play",unknown_date,reddit_discussion
3983860,"""Nightwater"" gameplay",general,1,tavily,basic,3,https://www.youtube.com/watch?v=jivkw0wrZ88,What Mysteries Does The Lighthouse Hold | Variety Gaming,"Nightwater gameplay awaits on GamerQuest! Join me for some epic gameplay moments as part of my variety gaming adventures with AAA, indie,",unknown_date,web_result
3983860,"""Nightwater"" demo",general,1,tavily,basic,4,https://steamcommunity.com/app/3983860,Nightwater,"The Nightwater demo will be released on May 8, 2026! The demo includes the first area, “The Woods,” with all milestone items and unlocks, as well as the first",unknown_date,web_result
3983860,"""Nightwater"" demo",general,1,tavily,basic,4,https://www.youtube.com/watch?v=sbDqeE7ExvA,NightWater Demo Intro,Nightwater is a very interesting new Satisfactory style game with elements of incremental skill building.,unknown_date,web_result
3983860,"""Nightwater"" demo",general,1,tavily,basic,4,https://www.youtube.com/watch?v=WWYqKW4qutc,Nightwater Demo Gameplay (With Commentary),"Nightwater demo gameplay with commentary, featuring a survival crafting adventure where you forage resources, automate production, and expand",unknown_date,web_result
3983860,"""Nightwater"" demo",general,1,tavily,basic,4,https://store.steampowered.com/app/3983860/Nightwater,Nightwater on Steam,"Download Nightwater Demo Download This game is not yet available on Steam Planned Release Date: Q3 2026. Nightwater is a game about gathering, collecting, and",unknown_date,web_result
3983860,"""Nightwater"" demo",general,1,tavily,basic,4,https://www.youtube.com/shorts/fYDfqv1CZZA,The demo Main Menu for my indie game Nightwater! ...,"The demo Main Menu for my indie game Nightwater! (on Steam) Forage, craft and automate to grow your factory, unlock new technologies and expand",unknown_date,web_result
3983860,"""Nightwater"" release date",general,1,tavily,basic,5,https://steamcommunity.com/app/3983860,Nightwater - Steam Community,"The Nightwater demo will be released on May 8, 2026! The demo includes the first area, “The Woods,” with all milestone items and unlocks, as well as the first",unknown_date,web_result
3983860,"""Nightwater"" release date",general,1,tavily,basic,5,https://www.youtube.com/watch?v=NR7zvacQZlU,Nightwater | Demo | 2026 - YouTube,... Nightwater/ Release Date: Q3 2026 Channel memberships are available ... nightwater #openworld #gaming #cemblack #keymailer Disclosure,unknown_date,web_result
3983860,"""Nightwater"" release date",general,1,tavily,basic,5,https://steamdb.info/app/3983860,Nightwater - SteamDB,"... Nightwater Steam charts, data, update history ... Release Date, Q3 2026. Forage, craft and automate to grow your factory, unlock",unknown_date,web_result
3983860,"""Nightwater"" release date",general,1,tavily,basic,5,https://www.gamingonlinux.com/2026/01/nightwater-looks-like-a-curious-blend-of-secrets-exploration-crafting-and-automation,"Nightwater looks like a curious blend of secrets, exploration, crafting ...",Due to release sometime in Q4 2026. Nightwater. Platform: Native Linux. Official links:Steam. Article taken from GamingOnLinux.com. Tags,unknown_date,web_result
3983860,"""Nightwater"" release date",general,1,tavily,basic,5,https://www.reddit.com/r/IndieGaming/comments/1q7irkq/just_announced_nightwater_a_game_inspired_by,"Just announced Nightwater, a game inspired by Forager ... - Reddit",Our game is launching on June 11th! r/IndieGaming - Our game is launching on June 11th! 1:23.,unknown_date,reddit_discussion
3983860,"""Nightwater"" announcement",general,1,tavily,basic,6,https://www.youtube.com/watch?v=rZhZlZPZPvc,Nightwater - Official Announcement Trailer,"Take a look at the Announcement Trailer for Nightwater, a sandbox resource management game developed by Studio Ashty.",unknown_date,web_result
3983860,"""Nightwater"" announcement",general,1,tavily,basic,6,https://www.reddit.com/r/IndieGaming/comments/1q7irkq/just_announced_nightwater_a_game_inspired_by,"Just announced Nightwater, a game inspired by Forager ...","After 6 months of hard work, my game Nightwater is finally ready to be announced! The Steam page and announcement trailer are online.",unknown_date,reddit_discussion
3983860,"""Nightwater"" announcement",general,1,tavily,basic,6,https://store.steampowered.com/app/3983860/Nightwater,Nightwater on Steam,"Planned Release Date: Q3 2026 ; Title: Nightwater ; Genre: Adventure, Casual, Indie, Simulation, Strategy. Developer: Studio Ashty. Publisher: Studio Ashty, Irox",unknown_date,web_result
3983860,"""Nightwater"" announcement",general,1,tavily,basic,6,https://store.steampowered.com/news/app/3983860/view/534376383746409090?snr=1_5_9_,Nightwater Official Playtest - Steam News,The first public playtest for <b>Nightwater</b>. Nightwater - Nightwater Official Playtest - Steam News. Shop News Charts Community Home Discussions,unknown_date,web_result
3983860,"""Nightwater"" announcement",general,1,tavily,basic,6,https://www.youtube.com/watch?v=UgTrrZZwGM0,First Look at Nightwater! - Survival Factory Builder,"In Nightwater we start with nothing — gathering resources, crafting tools, and slowly building automated factories across a mysterious island.",unknown_date,web_result
3983860,"""Nightwater"" preview",general,1,tavily,basic,7,https://steamcommunity.com/app/3983860,Steam Community :: Nightwater,"Get the Steam Mobile App. All trademarks are property of their respective owners in the US and other countries. Progress through the ages from sticks and stones to the Bronze Age, the Industrial Era and into the future to uncover the secret of the Lighthouse and escape this reality. Nightwater is part of Steam Next Fest June 2026, running now through June 22. If you haven't tried the demo yet, this is the perfect time to jump in and see what the game is about. Hi everyone, I’m excited to announce that Nightwater will be part of **Steam Next Fest: June 2026**! Since thousands of games will be available during Steam Next Fest, I wanted to take this opportunity to give a shout-out to a few other devs who are also participating in Steam Next Fest and working on awesome games! **Check the demo out and wishlist it!**. The Nightwater Demo is Out Now! The Nightwater demo is now live on Steam.",unknown_date,web_result
3983860,"""Nightwater"" preview",general,1,tavily,basic,7,https://www.youtube.com/watch?v=rZhZlZPZPvc,Nightwater - Official Announcement Trailer,"Take a look at the Announcement Trailer for Nightwater, a sandbox resource management game developed by Studio Ashty.",unknown_date,web_result
3983860,"""Nightwater"" preview",general,1,tavily,basic,7,https://www.dailymotion.com/video/x9ycpaa,Nightwater Official Announcement Trailer - video Dailymotion,"Take a look at the Announcement Trailer for Nightwater, a sandbox resource management game developed by Studio Ashty.",unknown_date,web_result
3983860,"""Nightwater"" preview",general,1,tavily,basic,7,https://www.youtube.com/watch?v=UgTrrZZwGM0,First Look at Nightwater! - Survival Factory Builder,"In Nightwater we start with nothing — gathering resources, crafting tools, and slowly building automated factories across a mysterious island.",unknown_date,web_result
3983860,"""Nightwater"" preview",general,1,tavily,basic,7,https://www.reddit.com/r/IndieGaming/comments/1q7irkq/just_announced_nightwater_a_game_inspired_by,"Just announced Nightwater, a game inspired by Forager ...","After 6 months of hard work, my game Nightwater is finally ready to be announced! The Steam page and announcement trailer are online.",unknown_date,reddit_discussion
3983860,"""Nightwater"" review",general,1,tavily,basic,8,https://www.nightwatermc.com/testimonials,"Testimonials & Reviews - New Orleans, LA: Nightwater Medical Center","I had a fantastic appointment! All of the staff are incredibly took friendly. Morgan really took the time to listen to my concerns, ask questions, and come up",unknown_date,web_result
3983860,"""Nightwater"" review",general,1,tavily,basic,8,https://www.gamingonlinux.com/2026/01/nightwater-looks-like-a-curious-blend-of-secrets-exploration-crafting-and-automation,"Nightwater looks like a curious blend of secrets, exploration, crafting and automation | GamingOnLinux","This website makes use of cookies to enhance your browsing experience and provide additional functionality -> More info Deny Cookies - Allow Cookies. One to stick into your list to keep an eye on is Nightwater, an open world exploration game that mixes in crafting and automation in a strange world. Starting off with primitive tools, and eventually up to modern machines with you gradually expanding the island into something much bigger to eventually reach a Lighthouse to reveal all the secrets. The developer mentions how it tells a ""deep, personal story that is never handed to you"" and as you explore you'll find lots of secrets requiring you to piece together what Nightwater really is. More from the Steam page:. Every resource features its own progression: gather by hand or automate with machines to hit each resource’s milestone goals and unlock new buildings, crafts, and powerful buffs. Automate all resources and their crafts, and unlock powerful late game buildings to make your factories faster, more efficient, and even bigger!",unknown_date,web_result
3983860,"""Nightwater"" review",general,1,tavily,basic,8,https://www.indeed.com/cmp/Nightwater-Clinic/reviews,Working at NIGHTWATER CLINIC: Employee Reviews | Indeed.com,"Great staff to work with. The environment is a pretty busy office, have anyone helps one another out to make everything run smoothly.",unknown_date,web_result
3983860,"""Nightwater"" review",general,1,tavily,basic,8,https://www.yelp.com/biz/nightwater-medical-center-new-orleans,NIGHTWATER MEDICAL CENTER - Updated June 2026 - Yelp,"Recommended Reviews - Nightwater Medical Center. Your trust is our priority, so businesses can't pay to alter or remove their reviews. Learn more about reviews.",unknown_date,web_result
3983860,"""Nightwater"" review",general,1,tavily,basic,8,https://store.steampowered.com/app/3983860/Nightwater,Nightwater on Steam,"Get the Steam Mobile App. All trademarks are property of their respective owners in the US and other countries. Link to the Steam Homepage. THIS GAME IS PART OF A SALE EVENT. Forage, craft and automate to grow your factory, unlock new technologies and expand your island to discover new biomes. Progress through the ages from sticks and stones to the Bronze Age, the Industrial Era and into the future to uncover the secret of the Lighthouse and escape this reality. Sign in to add this item to your wishlist, follow it, or mark it as ignored. Steam is learning about this game. This game is not yet available on Steam. All your efforts serve a single purpose: to reach ***the Lighthouse*** and uncover its secrets. Nightwater is a game about gathering, collecting, and managing resources. You can use this widget-maker to generate a bit of HTML that can be embedded in your website to easily allow customers to purchase this game on Steam.",unknown_date,web_result
3983860,"""Nightwater"" publisher",general,1,tavily,basic,9,https://www.gamesmarket.global/irox-publishes-nightwater-by-studio-ashty,Irox Publishes Nightwater by Studio Ashty,Irox Games from Munich has taken on Nightwater from Bosnian and Herzegovinan Studio Ashty as publisher. It is set to release in Q3 2026.,unknown_date,web_result
3983860,"""Nightwater"" publisher",general,1,tavily,basic,9,https://www.amazon.com/Nightwater-Book-Two-Night-2/dp/0996413820,"Nightwater: Book Two in the Night Series: Burdette, Alyson ...","Publisher, Frederick Publishing. Publication date, December 11, 2015. Language, ‎English. Print length, 180 pages. ISBN-10, 0996413820. ISBN-13, 978-0996413824.",unknown_date,web_result
3983860,"""Nightwater"" publisher",general,1,tavily,basic,9,https://steamdb.info/app/3983860,Nightwater - SteamDB,"Information. App ID, 3983860. App Type, Game. Developer, Studio Ashty. Publisher, Studio Ashty. Supported Systems, Windows Linux. Technologies, Unreal Engine",unknown_date,web_result
3983860,"""Nightwater"" publisher",general,1,tavily,basic,9,https://www.youtube.com/watch?v=rZhZlZPZPvc,Nightwater - Official Announcement Trailer - YouTube,"Take a look at the Announcement Trailer for Nightwater, a sandbox resource management game developed by Studio Ashty.",unknown_date,web_result
3983860,"""Nightwater"" publisher",general,1,tavily,basic,9,https://www.kirkusreviews.com/book-reviews/ken-follett/night-over-water,NIGHT OVER WATER - Kirkus Reviews,"NIGHT OVER WATER. by Ken Follett ‧ RELEASE DATE: Sept. 24, 1991. bookshelf ... 978-1-9848-2678-7. Page Count: 304. Publisher: Del Rey/Ballantine. Review",unknown_date,web_result
3983860,"""Nightwater"" developer",general,1,tavily,basic,10,https://steamdb.info/app/3983860,Nightwater - SteamDB,"Information. App ID, 3983860. App Type, Game. Developer, Studio Ashty. Publisher, Studio Ashty. Supported Systems, Windows Linux. Technologies, Unreal Engine",unknown_date,web_result
3983860,"""Nightwater"" developer",general,1,tavily,basic,10,https://www.gamingonlinux.com/2026/01/nightwater-looks-like-a-curious-blend-of-secrets-exploration-crafting-and-automation,"Nightwater looks like a curious blend of secrets, exploration, crafting ...","This website makes use of cookies to enhance your browsing experience and provide additional functionality -> More info Deny Cookies - Allow Cookies. One to stick into your list to keep an eye on is Nightwater, an open world exploration game that mixes in crafting and automation in a strange world. Starting off with primitive tools, and eventually up to modern machines with you gradually expanding the island into something much bigger to eventually reach a Lighthouse to reveal all the secrets. The developer mentions how it tells a ""deep, personal story that is never handed to you"" and as you explore you'll find lots of secrets requiring you to piece together what Nightwater really is. More from the Steam page:. Every resource features its own progression: gather by hand or automate with machines to hit each resource’s milestone goals and unlock new buildings, crafts, and powerful buffs. Automate all resources and their crafts, and unlock powerful late game buildings to make your factories faster, more efficient, and even bigger!",unknown_date,web_result
3983860,"""Nightwater"" developer",general,1,tavily,basic,10,https://steamcommunity.com/app/3983860,Nightwater,"Get the Steam Mobile App. All trademarks are property of their respective owners in the US and other countries. Progress through the ages from sticks and stones to the Bronze Age, the Industrial Era and into the future to uncover the secret of the Lighthouse and escape this reality. Nightwater is part of Steam Next Fest June 2026, running now through June 22. If you haven't tried the demo yet, this is the perfect time to jump in and see what the game is about. Hi everyone, I’m excited to announce that Nightwater will be part of **Steam Next Fest: June 2026**! Since thousands of games will be available during Steam Next Fest, I wanted to take this opportunity to give a shout-out to a few other devs who are also participating in Steam Next Fest and working on awesome games! **Check the demo out and wishlist it!**. The Nightwater Demo is Out Now! The Nightwater demo is now live on Steam.",unknown_date,web_result
3983860,"""Nightwater"" developer",general,1,tavily,basic,10,https://www.youtube.com/watch?v=OVeR2UyeH68,"Automation, Expansion & The Lighthouse Mystery - Nightwater First ...",Nightwater – From Sticks & Stones to a Futuristic Factory Empire! Nightwater is a progression-driven survival factory builder where you'll,unknown_date,web_result
3983860,"""Nightwater"" developer",general,1,tavily,basic,10,https://www.youtube.com/watch?v=CScBa6FSnnQ,NIGHTWATER - Transforming Resources From Sticks And Stones ...,... #resourcemanagement #automationgame #sandboxgame NIGHTWATER ... Belts of Iron - Solo Dev Creates AWESOME Open World Factory Game First Look.,unknown_date,web_result
3983860,"site:reddit.com ""Nightwater""",social,3,tavily,basic,11,https://www.reddit.com/r/DnD/comments/xk8e9p/oc_nightwater_arena_18x18,[OC] Nightwater Arena [18x18] : r/DnD - Reddit,"Nightwater is a self sustainable city built in the sewers, where everyone has the same opportunities. There is no authority there but Nightwater…",unknown_date,reddit_discussion
3983860,"site:reddit.com ""Nightwater""",social,3,tavily,basic,11,https://www.reddit.com/r/UnrealEngine5/comments/1rhxd4j/my_indie_game_nightwater_is_doing_its_first_steam,My indie game Nightwater is doing its first Steam playtest in 1 week ...,"Hi! I'm a solo dev working on Nightwater, a 3D automation/crafting game with incremental progression. Inspired by Forager/Cauldron and early",unknown_date,reddit_discussion
3983860,"site:reddit.com ""Nightwater""",social,3,tavily,basic,11,https://www.reddit.com/r/HFY/comments/44zuvf/oc_nightwater,[OC] Nightwater : r/HFY - Reddit,"We taught humanity many things, such as how to shape ionic forces and our techniques for sailing nightwater. In turn, they showed us many of",unknown_date,reddit_discussion
3983860,"site:reddit.com ""Nightwater""",social,3,tavily,basic,11,https://www.reddit.com/r/IndieDev/comments/1q7ispa/just_announced_nightwater_a_game_inspired_by?tl=tr,Forager ve Cauldron'dan ilham alan bir oyun olan Nightwater'ı ...,"6 aylık sıkı çalışmanın ardından, oyunum Nightwater'ın duyurusu nihayet hazır! Steam sayfası ve duyuru fragmanı yayında.",unknown_date,reddit_discussion
3983860,"site:reddit.com ""Nightwater""",social,3,tavily,basic,11,https://www.reddit.com/r/IndieGaming/comments/1q7irkq/just_announced_nightwater_a_game_inspired_by,"Just announced Nightwater, a game inspired by Forager ... - Reddit","After 6 months of hard work, my game Nightwater is finally ready to be announced! The Steam page and announcement trailer are online.",unknown_date,reddit_discussion
3983860,"site:tiktok.com ""Nightwater""",social,4,tavily,basic,12,https://www.tiktok.com/@studio.ashty/video/7611574043266977047,Discover the First Moments of Nightwater: An Indie Game - TikTok,Nightwater is an exciting new indie game that has just launched on Steam. showcases the rich graphics and engaging gameplay powered by Unreal,unknown_date,social_post
3983860,"site:tiktok.com ""Nightwater""",social,4,tavily,basic,12,https://www.tiktok.com/@nightwater21,nightwater (@nightwater21) | TikTok,"nightwater (@nightwater21) on TikTok | 6092 Likes. 1450 Followers. Watch nightwater's popular videos: """", """". Join 1450 followers on TikTok for more",unknown_date,social_post
3983860,"site:tiktok.com ""Nightwater""",social,4,tavily,basic,12,https://www.tiktok.com/@nightwater21/video/7638052972395531534,nightwater (@nightwater21)'s videos with original sound - TikTok,"This curated underwater music video mix offers serene, visually rich experiences combining mermaids, marine life, and anime aesthetics, often",unknown_date,social_post
3983860,"site:tiktok.com ""Nightwater""",social,4,tavily,basic,12,https://www.tiktok.com/@starface/video/7037513025116638511,Transform Your Skin with Starface Exfoliating Night Water - TikTok,"Experience a glowing transformation with Starface's exfoliating Night Water. See the before and after results of brighter, smoother skin after a week of use.",unknown_date,social_post
3983860,"site:tiktok.com ""Nightwater""",social,4,tavily,basic,12,https://www.tiktok.com/@nightwater21/video/7561227094290746655,nightwater (@nightwater21)'s videos with som original - sᴀɴᴛ,Learn how to make crispy and flavorful homemade fried chicken that rivals Raising Cane's! Follow our easy step-by-step instructions and enjoy a,unknown_date,social_post
3983860,"site:instagram.com ""Nightwater""",social,4,tavily,basic,13,https://www.instagram.com/nightwaterm_center,Nightwater Medical Center (@nightwaterm_center) - Instagram,"Located in New Orleans. A concierge service providing a customized, preventive healthcare plan for YOU. today (504)381-4204.",unknown_date,social_post
3983860,"site:instagram.com ""Nightwater""",social,4,tavily,basic,13,https://www.instagram.com/nightwaterhealthca,Nightwater Health Primary Care (@nightwaterhealthca) - Instagram,"Prevention is very broad. It includes age-specific screenings, cardiac screenings, women's wellness, preconception planning, vaccines, masks, safe functional",unknown_date,social_post
3983860,"site:instagram.com ""Nightwater""",social,4,tavily,basic,13,https://www.instagram.com/nightwaterprintshop,Night Water Print Shop (@nightwaterprintshop) - Instagram,Handmade linocut prints by @gbrlbrnbm. available @thebrooklynartery or sometimes via DM. Follow. Message. '(ethereal music)' and 'held by the moon',unknown_date,social_post
3983860,"site:instagram.com ""Nightwater""",social,4,tavily,basic,13,https://www.instagram.com/nightwatermemes,Night Water (@nightwatermemes) • Instagram photos and videos,75 followers · 7 following · 70 posts · @nightwatermemes: “the official meme page of the Night Water newsletter”,unknown_date,social_post
