appid,query,query_group,query_priority,provider,tavily_search_depth,budget_query_number,url,title,snippet,date_classification,evidence_type
3983860,"site:instagram.com ""Nightwater""",social,4,tavily,basic,13,https://www.instagram.com/p/DXaG6e1k-Cz,Meet Captain Nightwater       Before heading off on ... - Instagram,"This is Captain Nightwater. He and his villainous pirate crew travel on their enchanted ship, pillaging and destroying each port they take",unknown_date,social_post
3983860,"site:x.com ""Nightwater""",social,4,tavily,basic,14,https://x.com/playtesterhq/status/2052848545611513971,Nightwater is an automation and resource-management demo ...,"Nightwater is an automation and resource-management demo where you forage, craft, and build a growing island factory, advance through eras, and unravel the",unknown_date,social_post
3983860,"site:x.com ""Nightwater""",social,4,tavily,basic,14,https://x.com/CivicAmar,Amar Civic - Nightwater (@CivicAmar) / Posts / X - Twitter,"Do you like Forager, Cauldron or Hypixel Skyblock? Then Nightwater might be just the game for you. - Forage, craft and automate to grow your factory",unknown_date,social_post
3983860,"site:x.com ""Nightwater""",social,4,tavily,basic,14,https://x.com/hashtag/nightwater?src=hashtag_click,"""#nightwater"" - Results on X | Live Posts & Updates",Night Water at White Water!Splash into the night from 10am to 10pm! #nightwater #whitewater for details see tinyurl.com/njq39am.,unknown_date,social_post
3983860,"site:x.com ""Nightwater""",social,4,tavily,basic,14,https://x.com/ReadySetIG/status/2059816611591413859,Hey Buds ☁️ WE ARE NOW LIVE on CheckpointVibes Nightwater ...,"Hey Buds ☁️ WE ARE NOW LIVE on CheckpointVibes. Nightwater, Net Raiders, On Your Own, SURI: The Seventh Note, OVER SAND & HitTube!",unknown_date,social_post
3983860,"site:x.com ""Nightwater""",social,4,tavily,basic,14,https://x.com/CivicAmar/status/2029227115556815005,Night in my indie game Nightwater! (on Steam) #indiegame ...,Amar Civic - Nightwater (@CivicAmar). 23 likes 451 views. Night in my indie game Nightwater! (on Steam) #indiegame #gamedev #UnrealEngine.,unknown_date,social_post
3983860,"site: ""Nightwater""",social,4,tavily,basic,15,https://store.steampowered.com/app/3983860/Nightwater,Nightwater on Steam,"Get the Steam Mobile App. All trademarks are property of their respective owners in the US and other countries. Link to the Steam Homepage. THIS GAME IS PART OF A SALE EVENT. Forage, craft and automate to grow your factory, unlock new technologies and expand your island to discover new biomes. Progress through the ages from sticks and stones to the Bronze Age, the Industrial Era and into the future to uncover the secret of the Lighthouse and escape this reality. Sign in to add this item to your wishlist, follow it, or mark it as ignored. Steam is learning about this game. This game is not yet available on Steam. All your efforts serve a single purpose: to reach ***the Lighthouse*** and uncover its secrets. Nightwater is a game about gathering, collecting, and managing resources. You can use this widget-maker to generate a bit of HTML that can be embedded in your website to easily allow customers to purchase this game on Steam.",unknown_date,social_post
3983860,"site: ""Nightwater""",social,4,tavily,basic,15,https://www.nightwater.email,Night Water,"Night Water. A late night, idiosyncratic niche culture newsletter. As refreshing as a glass of cold water at 3 a.m.. Subscribe",unknown_date,social_post
3983860,"site: ""Nightwater""",social,4,tavily,basic,15,https://www.riversportokc.org/event/nightwater,RIVERSPORT NightWater,"Join us Thursday & Friday evenings June 4 – July 10 and July 30 – August 7 from 5 to 8p for NightWater rafting, tubing and surfing, plus live music and Big",unknown_date,social_post
3983860,"site: ""Nightwater""",social,4,tavily,basic,15,https://www.reddit.com/r/IndieGaming/comments/1q7irkq/just_announced_nightwater_a_game_inspired_by,"Just announced Nightwater, a game inspired by Forager and Cauldron! : r/IndieGaming","# Just announced Nightwater, a game inspired by Forager and Cauldron! Skip to main contentJust announced Nightwater, a game inspired by Forager and Cauldron! Open menu Open navigationGo to Reddit Home. Image 1 Go to IndieGaming. After 6 months of hard work, my game Nightwater is finally ready to be announced! The Steam page and announcement trailer are online. If the game looks interesting to you, please visit the Steam page and wishlist the game. Here is the steam page: https://store.steampowered.com/app/3983860/Nightwater/. I am also open to any feedback! *   Image 5: Real talk from real sellers: Shopify is the easiest way to start. Real talk from real sellers: Shopify is the easiest way to start. Check it out if you'd like to discuss game development or find and share new indie games to play :). Please__contact the moderators of this subreddit__if you have any questions or concerns._. Join the r/IndieGaming Discord server! *   Best of Reddit in Portuguese. *   Best of Reddit in German.",unknown_date,reddit_discussion
3983860,"site: ""Nightwater""",social,4,tavily,basic,15,https://www.youtube.com/watch?v=rZhZlZPZPvc,Nightwater - Official Announcement Trailer - YouTube,"Take a look at the Announcement Trailer for Nightwater, a sandbox resource management game developed by Studio Ashty.",unknown_date,social_post
