appid,query,video_id,url,title,contents_preview,published_at,date_classification,evidence_type
3847920,"""Wild n Chill"" trailer",dhZew51BkII,https://www.youtube.com/watch?v=dhZew51BkII,Wild n Chill - Announcement Trailer,Wishlist Now on Steam: https://store.steampowered.com/app/3847920/Wild_n_Chill Wild n Chill is a laid-back wilderness escape ...,2026-05-28T19:06:19+00:00,inside_spike_window,youtube_video
3847920,"""Wild n Chill"" trailer",Xoa_BWWwtSE,https://www.youtube.com/watch?v=Xoa_BWWwtSE,Wild n Chill | Announcement Trailer,"Wild n Chill is a laid-back wilderness escape where ya forage, hunt, and craft the off-grid cabin of your dreams. Far from the noise ...",2026-05-29T09:05:30+00:00,inside_extended_window,youtube_video
3847920,"""Wild n Chill"" trailer",vRGb85oOH8w,https://www.youtube.com/watch?v=vRGb85oOH8w,受賞はあの作品！ チルゲーアワードの受賞作＆ワールドプレミアな発表を見たぞ！【Cozy Game Awards 2026】【日本人の反応】,"前回勝手に紹介した""Cozy Game Awards""がShowcaseスタイルで開催されたのでリアクション録りました！ 受賞作とワールド ...",2026-05-29T09:00:11+00:00,inside_extended_window,youtube_video
3847920,"""Wild n Chill"" gameplay",2VKGrilIAqY,https://www.youtube.com/watch?v=2VKGrilIAqY,Wild n Chill - New Survival Game Announcement,Wishlist Now on Steam: https://store.steampowered.com/app/3847920/Wild_n_Chill Wild n Chill is a laid-back wilderness escape ...,2026-05-29T00:33:29+00:00,inside_extended_window,youtube_video
3847920,"""Wild n Chill"" gameplay",ZjQ26llWGAw,https://www.youtube.com/watch?v=ZjQ26llWGAw,RED DEAD REDEMPTION 2 CLASSIC Walkthrough PART 7!! LIVE Wild n Chill GAMEPLAY,HIT SUBSCRIBE HIT BELL NOTIFICATION FOR WILD & CHILL MOMENTS LIVE EVERY DAY OR EVERY OTHER DAY.,2025-06-04T19:04:56+00:00,outside_window,youtube_video
3847920,"""Wild n Chill"" gameplay",shPwP-GnuUE,https://www.youtube.com/watch?v=shPwP-GnuUE,🦊 Breath of the Wild &#39;n&#39; Chill 🦊  |  The Legend of Zelda: Breath of the Wild,Come watch over at twitch.tv/slackersavant! #gaming #twitch #vtuber #envtuber #live #livestream #youtube #thelegendofzelda ...,2026-01-20T20:29:59+00:00,outside_window,youtube_video
3847920,"""Wild n Chill"" gameplay",5B-KzP4Mmec,https://www.youtube.com/watch?v=5B-KzP4Mmec,🦊 Breath of the Wild &#39;n&#39; Chill 🦊  |  The Legend of Zelda: Breath of the Wild,Come watch over at twitch.tv/slackersavant! #gaming #twitch #vtuber #envtuber #live #livestream #youtube #thelegendofzelda ...,2026-01-20T17:00:34+00:00,outside_window,youtube_video
3847920,"""Wild n Chill"" gameplay",MPeBoDImzEQ,https://www.youtube.com/watch?v=MPeBoDImzEQ,🦊 Breath of the Wild &#39;n&#39; Chill 🦊  |  The Legend of Zelda: Breath of the Wild,Come watch over at twitch.tv/slackersavant! #gaming #twitch #vtuber #envtuber #live #livestream #youtube #thelegendofzelda ...,2026-01-20T17:07:07+00:00,outside_window,youtube_video
