appid,query,video_id,url,title,contents_preview,published_at,date_classification,evidence_type
3738830,"""Bodycam Onrecord"" trailer",otu_iFTivQw,https://www.youtube.com/watch?v=otu_iFTivQw,UNRECORD Trailer 4K (New Photorealistic Body Cam Game 2024),UNRECORD Gameplay Trailer (New Ultra Photorealistic Body Cam Game 2024) Unrecord is a tactical shooter where players can ...,2023-04-19T19:56:53+00:00,outside_window,youtube_video
3738830,"""Bodycam Onrecord"" trailer",ljZ--80ZnBs,https://www.youtube.com/watch?v=ljZ--80ZnBs,What Happened To Unrecord? | #shorts,Unrecord Bodycam Hyper-realistic shooter #gaming #unrecord thx @devon-fl for fun-made Unrecord soundtrack.,2025-10-12T18:00:47+00:00,outside_window,youtube_video
3738830,"""Bodycam Onrecord"" trailer",IK76q13Aqt0,https://www.youtube.com/watch?v=IK76q13Aqt0,Unrecord - Official Early Gameplay Trailer,"Here's your look at early gameplay from Unrecord, an upcoming single-player FPS that tells the story of a tactical police officer ...",2023-04-19T19:00:04+00:00,outside_window,youtube_video
3738830,"""Bodycam Onrecord"" trailer",pQjPv_oWNBI,https://www.youtube.com/watch?v=pQjPv_oWNBI,Bodycam - Exclusive Trailer (2026),"Check out the brand new trailer for Bodycam, the supernatural horror movie from director Brandon Christensen (Night of the ...",2026-02-18T16:01:22+00:00,outside_window,youtube_video
3738830,"""Bodycam Onrecord"" trailer",lt1hodBObHw,https://www.youtube.com/watch?v=lt1hodBObHw,BODY CAM | Official Trailer | Paramount Movies,"Now on Digital, Blu-ray™& DVD Get it now: https://paramnt.us/BodyCamOfficialSite While investigating the bizarre murder of a ...",2020-05-19T15:00:23+00:00,outside_window,youtube_video
3738830,"""Bodycam Onrecord"" gameplay",4RvpHYsZ8FU,https://www.youtube.com/watch?v=4RvpHYsZ8FU,This guy didn&#39;t expect this. Bodycam game,,2024-06-10T08:47:54+00:00,outside_window,youtube_video
3738830,"""Bodycam Onrecord"" gameplay",zpmYTxQXRDM,https://www.youtube.com/watch?v=zpmYTxQXRDM,BODYCAM: Ultra Realistic Graphics &amp; Combat Showcase in 4K (RTX 5090),"Bodycam 4K MAX settings gameplay featuring a compilation of intense combat moments, realistic ragdoll physics and amazing ...",2025-12-06T10:41:00+00:00,outside_window,youtube_video
3738830,"""Bodycam Onrecord"" gameplay",_Gh0x9mtIuQ,https://www.youtube.com/watch?v=_Gh0x9mtIuQ,It&#39;s Scary How Realistically the Body Reacts to the Bullets! BODYCAM,"Bodycam is an ultra-realistic multiplayer, first-person shooter game made using the latest technologies of the next-gen game ...",2024-06-06T08:03:25+00:00,outside_window,youtube_video
3738830,"""Bodycam Onrecord"" gameplay",ljZ--80ZnBs,https://www.youtube.com/watch?v=ljZ--80ZnBs,What Happened To Unrecord? | #shorts,Unrecord Bodycam Hyper-realistic shooter #gaming #unrecord thx @devon-fl for fun-made Unrecord soundtrack.,2025-10-12T18:00:47+00:00,outside_window,youtube_video
3738830,"""Bodycam Onrecord"" gameplay",hkcUWXEFKSE,https://www.youtube.com/watch?v=hkcUWXEFKSE,Ragdolls Physics in BODYCAM Game! #bodycamgame #unrealengine5,bodycam #realistic #fpsgames Bodycam is first person shooter multiplayer game using the latest next-gen Unreal Engine 5.,2024-09-08T20:57:57+00:00,outside_window,youtube_video
3738830,"""Bodycam Onrecord"" demo",4RvpHYsZ8FU,https://www.youtube.com/watch?v=4RvpHYsZ8FU,This guy didn&#39;t expect this. Bodycam game,,2024-06-10T08:47:54+00:00,outside_window,youtube_video
3738830,"""Bodycam Onrecord"" demo",zpmYTxQXRDM,https://www.youtube.com/watch?v=zpmYTxQXRDM,BODYCAM: Ultra Realistic Graphics &amp; Combat Showcase in 4K (RTX 5090),"Bodycam 4K MAX settings gameplay featuring a compilation of intense combat moments, realistic ragdoll physics and amazing ...",2025-12-06T10:41:00+00:00,outside_window,youtube_video
3738830,"""Bodycam Onrecord"" demo",ljZ--80ZnBs,https://www.youtube.com/watch?v=ljZ--80ZnBs,What Happened To Unrecord? | #shorts,Unrecord Bodycam Hyper-realistic shooter #gaming #unrecord thx @devon-fl for fun-made Unrecord soundtrack.,2025-10-12T18:00:47+00:00,outside_window,youtube_video
3738830,"""Bodycam Onrecord"" demo",_Gh0x9mtIuQ,https://www.youtube.com/watch?v=_Gh0x9mtIuQ,It&#39;s Scary How Realistically the Body Reacts to the Bullets! BODYCAM,"Bodycam is an ultra-realistic multiplayer, first-person shooter game made using the latest technologies of the next-gen game ...",2024-06-06T08:03:25+00:00,outside_window,youtube_video
3738830,"""Bodycam Onrecord"" demo",otu_iFTivQw,https://www.youtube.com/watch?v=otu_iFTivQw,UNRECORD Trailer 4K (New Photorealistic Body Cam Game 2024),UNRECORD Gameplay Trailer (New Ultra Photorealistic Body Cam Game 2024) Unrecord is a tactical shooter where players can ...,2023-04-19T19:56:53+00:00,outside_window,youtube_video
