appid,query,query_group,query_priority,provider,tavily_search_depth,budget_query_number,url,title,snippet,date_classification,evidence_type
2433630,"""The Left Behind"" Steam",general,1,tavily,basic,1,https://store.steampowered.com/app/2433630/The_Left_Behind,The Left Behind on Steam,"Get the Steam Mobile App. All trademarks are property of their respective owners in the US and other countries. Link to the Steam Homepage. The Left Behind is a solo and co-op post-apocalyptic survival game. Zombies  Exploration  Third-Person Shooter  Post-apocalyptic  Perma Death  PvE  Action-Adventure  Third Person  3D  Horror  Open World  Choices Matter  Action  Stealth  Survival  Atmospheric  Adventure  Combat  Co-op  Local Co-Op. Sign in to add this item to your wishlist, follow it, or mark it as ignored. Steam is learning about this game. This game is not yet available on Steam. Discover the personality of each building, the world and the people that used to live in it. Survive with up to four (4) people as long as you can in this harsh world. * You can enter and explore every building in the game. You can use this widget-maker to generate a bit of HTML that can be embedded in your website to easily allow customers to purchase this game on Steam.",unknown_date,web_result
2433630,"""The Left Behind"" Steam",general,1,tavily,basic,1,https://steamcommunity.com/app/2433630,Steam Community :: The Left Behind,"The Left Behind is a solo and co-op post-apocalyptic survival game. In this post I'm going to talk you through what the game will be and what is not in the game so you can make the right decision if this game is something for you. **What's in the game?**The game is a solo and co-op zombie survival game that leans towards an arcade zombie experience. This is in the game to stimulate exploring the open-world. * Story mode - This is the main mode of the game. * Survival mode - This has the same difficulty as the story mode and can be played in solo and co-op. The survival mode takes place in the open-world map and does not feature story elements. * Easy mode - This mode takes place in the open-world map, you can experience the story without the horde nights. You can play the story in solo mode and get a preview of how it will play.",unknown_date,web_result
2433630,"""The Left Behind"" Steam",general,1,tavily,basic,1,https://steamcommunity.com/app/2433630?curator_clanid=4777282,Steam Community :: The Left Behind,"The Left Behind is a solo and co-op post-apocalyptic survival game. Demo update 0.1.9 - and The Left Behind will join this months NextFest! I've added a bit more loot, fixed a couple of multiplayer issues and did some quality of life updates. I'm super excited to join NextFest with the demo and hope all the new players enjoy the zombie experience I've made! The full game will release on the 27th of July! * Added more loot to the world;. In this post I'm going to talk you through the state of the demo and what you can expect in the full release of the game. You can play the story in solo mode and get a preview of how it will play. This is a mode where you can explore the map and survive as long as possible in co-op mode. I've added a bit more loot in the starting area, fixed a couple of multiplayer issues and did some quality of life updates.",unknown_date,web_result
2433630,"""The Left Behind"" Steam",general,1,tavily,basic,1,https://store.steampowered.com/app/2854130/Left_Behind,Left Behind on Steam,"Get the Steam Mobile App. All trademarks are property of their respective owners in the US and other countries. Link to the Steam Homepage. LEFT BEHIND is a hyper-realistic psychological horror game where you take on the role of a real estate agent with a client looking to sell you a property. Mixed  (74)   - 60% of the 74 user reviews for this game are positive. **LEFT BEHIND** Is a proudly pinoy-made realistic psychological horror game where you take on the role of a real estate agent with a client looking to sell you a property. This game requires the use of a microphone for certain parts of the gameplay. With your microphone, you can speak and hear your voice in real-time within the game, with effects that vary depending on your in-game location. You can use this widget-maker to generate a bit of HTML that can be embedded in your website to easily allow customers to purchase this game on Steam.",unknown_date,web_result
2433630,"""The Left Behind"" Steam",general,1,tavily,basic,1,https://steamdb.info/app/2433630,The Left Behind,The Left Behind is a solo and co-op post-apocalyptic survival game. Explore a typical Dutch open-world landscape at daytime and beware of hordes of enemies,unknown_date,web_result
2433630,"""The Left Behind"" trailer",general,1,tavily,basic,2,https://www.youtube.com/watch?v=GrXe8YDbzYs,Left Behind Official Trailer #1 (2014) - Nicolas Cage Movie HD,"LEFT BEHIND follows Rayford Steele (Nicolas Cage) who is piloting a commercial airliner just hours after the Rapture when millions of people around the globe simply vanish. Thirty thousand feet over the Atlantic, Rayford is faced with a damaged plane, terrified passengers, and a desperate desire to get back to his family. On the ground, his daughter, Chloe Steele (Cassi Thomson) is among those left behind, forced to navigate a world of madness as she searches for her lost mother and brother. [...] # Left Behind Official Trailer #1 (2014) - Nicolas Cage Movie HD
## Rotten Tomatoes Trailers
16200000 subscribers
23644 likes

### Description
9051802 views
Posted: 6 Aug 2014
Subscribe to TRAILERS: 
Subscribe to COMING SOON: 
Like us on FACEBOOK: 
Follow us on TWITTER: 
Left Behind Official Trailer #1 (2014) - Nicolas Cage Movie HD [...] [Music] hello hi Mom Chloe welcome home so is everything sat for dad's surprise party H he got called into work can I buy you a coffee I'm waiting for someone my dad hi sweetheart hey welcome aboard hancon flight 257 to London flight time today will be 6 hours and 30 minutes I love you people from all over this plane have simply vanished Chris let me in Chris me [Music] I know you all want answers and believe me so do I and I'll do my best to get them I heard some doctors talking it's not just",unknown_date,web_result
2433630,"""The Left Behind"" trailer",general,1,tavily,basic,2,https://www.youtube.com/watch?v=3thlR9_3K2k,Left Behind (2000) Rerelease Trailer 2014,LEFT BEHIND follows Rayford Steele (Nicolas Cage) who is piloting a commercial airliner just hours after the Rapture when millions of people,unknown_date,web_result
2433630,"""The Left Behind"" trailer",general,1,tavily,basic,2,https://www.imdb.com/video/vi682607385,Official Trailer - Left Behind: The Movie,The Biblical prophecy of Armegeddon begins when the Rapture instantly takes all believers in Christ from the Earth. A reporter left behind learns that the Anti,unknown_date,web_result
2433630,"""The Left Behind"" trailer",general,1,tavily,basic,2,https://www.movieinsider.com/m10845/left-behind/videos/11080,Left Behind Theatrical Trailer Video,Left Behind Theatrical Trailer - Follows Rayford Steele (Nicolas Cage) who is piloting a commercial airliner just hours after the Rap.,unknown_date,web_result
2433630,"""The Left Behind"" trailer",general,1,tavily,basic,2,https://www.youtube.com/watch?v=SYjSUu5RjoM,"Left Behind: The Movie 🎬 Full Action Drama Movie | Kirk Cameron, Brad Johnson","00:00 – The Attack That Changed Everything
03:47 – The Miracle Crop That Could Save Humanity
06:13 – Israel Faces Total Destruction
10:18 – A Family's Last Normal Day
14:00 – The Conspiracy Nobody Believed
26:25 – People Start Vanishing Without a Trace
32:03 – Worldwide Chaos and Emergency Declarations
53:04 – A Pastor Realizes He Was Wrong
01:12:00 – The Shocking Biblical Explanation
01:24:48 – The Antichrist's Rise Begins [...] missing flight crews, planes down all over. We're turning back. [sirens] [music] [panicked voices] Your attention please. The federal government has
 declared a National state of Emergency. Please remain calm and stand
 by for further instructions. Come on Dirk. Come on. All circuits are busy,
 please try again later. [crying] Black or white, rich or
 poor both here and abroad. The death of the President
 adds to the list of world leaders lost or missing. Nicolae Carpathia: the [...] technician problems. They're over Jerusalem. The Eden Project could
have fed the whole world. But now, that miracle is
going to die with us. [explosions] Those planes are coming down,
but we haven't fired a shot. It's not possible, they're
jamming our monitors! It's a cruel trick. Only one way to find out. NO! Buck! [explosions] This is Buck Williams
reporting live from Israel. I am standing in the middle
of an all out attack. The sun is gone. Thousands of planes",unknown_date,web_result
2433630,"""The Left Behind"" gameplay",general,1,tavily,basic,3,https://www.dictionary.com/browse/the,THE Definition & Meaning,"*   [Games](https://www.dictionary.com/games). *   [the](https://www.dictionary.com/browse/the#hdr-headword-dcom-1)the definite article (used, especially before a noun, with a specifying or particularizing effect, as opposed to the indefinite or generalizing force of the indefinite article _a_ or _an_ ). *   [Pronunciation](https://www.dictionary.com/browse/the#id-sec-notes-pronunciation). *   [Related Words](https://www.dictionary.com/browse/the#id-sec-related-words). 1.   used preceding a noun that has been previously specified Compare [a 1](https://www.dictionary.com/browse/a). 2.   used with a qualifying word or phrase to indicate a particular person, object, etc, as distinct from others Compare [a 1](https://www.dictionary.com/browse/a). > [![Image 3: Logo link to The Wall Street Journal](https://cdn.dictionary.com/logo-ex-src-wsj-CyEa4Gzc.svg)](https://www.wsj.com/business/bill-gatess-personal-emails-werent-part-of-epstein-review-95f1964a). > [![Image 4: Logo link to Los Angeles Times](https://cdn.dictionary.com/logo-ex-src-lat-D0Usm19z.svg)](https://www.latimes.com/sports/lakers/story/2026-07-22/lebron-james-is-taking-his-time-team-hunting-but-warriors-as-option). > [![Image 5: Logo link to The Wall Street Journal](https://cdn.dictionary.com/logo-ex-src-wsj-CyEa4Gzc.svg)](https://www.wsj.com/business/bill-gatess-personal-emails-werent-part-of-epstein-review-95f1964a). > [![Image 6: Logo link to Los Angeles Times](https://cdn.dictionary.com/logo-ex-src-lat-D0Usm19z.svg)](https://www.latimes.com/sports/lakers/story/2026-07-22/lebron-james-is-taking-his-time-team-hunting-but-warriors-as-option). > [![Image 8: Logo link to Forbes](https://cdn.dictionary.com/logo-ex-src-news-TLlDtEp4.svg)](https://www.seattletimes.com/entertainment/review-the-long-kiss-goodbye-ends-at-new-yorks-madison-square-garden-but-kiss-avatars-loom/). > [![Image 9: Logo link to Forbes](https://cdn.dictionary.com/logo-ex-src-news-TLlDtEp4.svg)](https://www.scientificamerican.com/article/methadone-maintenance-versus-synthetic-heaven-inside-the-historic-fight-over-heroin-treatment/). > [![Image 11: Logo link to Forbes](https://cdn.dictionary.com/logo-ex-src-news-TLlDtEp4.svg)](http://www.forbes.com/sites/mfonobongnsehe/2014/09/05/young-african-millionaire-ashish-j-thakkar-launches-mara-mentor-in-ghana/). *   [every](https://www.dictionary.com/browse/every). [![Image 13](https://cdn.dictionary.com/dcom-footer-logo-D3hiCHBw.svg)](https://www.dictionary.com/). [![Image 23](https://cdn.dictionary.com/tcom-footer-brands-logo-Ce0ywHGh.svg)](https://www.thesaurus.com/). [![Image 24](https://cdn.dictionary.com/vocab-footer-brands-logo-BlMloknW.svg)](https://www.vocabulary.com/). [![Image 25](https://cdn.dictionary.com/words-footer-brands-logo-DGX_eyNx.svg)](https://www.words.com/). [![Image 26](https://cdn.dictionary.com/ingles-footer-brands-logo-Cj0_mi36.svg)](https://www.ingles.com/). [![Image 27](https://cdn.dictionary.com/spanish-dict-footer-brands-logo-4FlU3dl5.svg)](https://www.spanishdict.com/). [![Image 28](https://cdn.dictionary.com/french-dict-footer-brands-logo-CpczaTEW.svg)](https://www.frenchdictionary.com/). [![Image 30](https://cdn.dictionary.com/ixl-footer-brands-logo-ecUK1g3T.svg)](https://www.ixl.com/). [![Image 31](https://cdn.dictionary.com/tpt-footer-brands-logo-DDu69lkn.svg)](https://www.teacherspayteachers.com/). [![Image 32](https://cdn.dictionary.com/edcom-footer-brands-logo-CqMly76v.svg)](https://www.education.com/). [![Image 33](https://cdn.dictionary.com/abcya-footer-brands-logo-C6ORZBhp.svg)](https://www.abcya.com/). [![Image 34](https://cdn.dictionary.com/wyzant-footer-brands-logo-XsKkZY9f.svg)](https://www.wyzant.com/). [![Image 35](https://cdn.dictionary.com/multcom-footer-brands-logo-0pGBnyvb.svg)](https://www.multiplication.com/).",unknown_date,web_result
2433630,"""The Left Behind"" gameplay",general,1,tavily,basic,3,https://www.merriam-webster.com/dictionary/the,THE Definition & Meaning,"*   [Word of the Day](https://www.merriam-webster.com/word-of-the-day). *   [Word Finder](https://www.merriam-webster.com/wordfinder). *   [Word of the Day](https://www.merriam-webster.com/word-of-the-day). *   [Word Finder](https://www.merriam-webster.com/wordfinder). *   [My Words](https://www.merriam-webster.com/saved-words). *   [![Image 1](https://prod.cdn-mw.com/dist-cross-dungarees/2026-07-21--18-32-41-ahbhs/images/svg/sidebar-nav-item-icon.svg)definite article](https://www.merriam-webster.com/dictionary/the#dictionary-entry-1). *   [![Image 2](https://prod.cdn-mw.com/dist-cross-dungarees/2026-07-21--18-32-41-ahbhs/images/svg/sidebar-nav-item-icon.svg)adverb](https://www.merriam-webster.com/dictionary/the#dictionary-entry-2). *   [![Image 3](https://prod.cdn-mw.com/dist-cross-dungarees/2026-07-21--18-32-41-ahbhs/images/svg/sidebar-nav-item-icon.svg)preposition](https://www.merriam-webster.com/dictionary/the#dictionary-entry-3). *   [![Image 4](https://prod.cdn-mw.com/dist-cross-dungarees/2026-07-21--18-32-41-ahbhs/images/svg/sidebar-nav-item-icon.svg)combining form](https://www.merriam-webster.com/dictionary/the#dictionary-entry-4). *   [definite article 4![Image 5](https://prod.cdn-mw.com/dist-cross-dungarees/2026-07-21--18-32-41-ahbhs/images/svg/redesign/show-more-arrow.svg)](https://www.merriam-webster.com/dictionary/the#). *   [![Image 7](https://prod.cdn-mw.com/dist-cross-dungarees/2026-07-21--18-32-41-ahbhs/images/svg/sidebar-nav-item-icon.svg)Word History](https://www.merriam-webster.com/dictionary/the#word-history). *   [![Image 8](https://prod.cdn-mw.com/dist-cross-dungarees/2026-07-21--18-32-41-ahbhs/images/svg/sidebar-nav-item-icon.svg)Rhymes](https://www.merriam-webster.com/dictionary/the#related-rhymes). *   [![Image 9](https://prod.cdn-mw.com/dist-cross-dungarees/2026-07-21--18-32-41-ahbhs/images/svg/sidebar-nav-item-icon.svg)Entries Near](https://www.merriam-webster.com/dictionary/the#nearby-entries). *   [![Image 10](https://prod.cdn-mw.com/dist-cross-dungarees/2026-07-21--18-32-41-ahbhs/images/svg/sidebar-nav-item-icon.svg)Related Articles](https://www.merriam-webster.com/dictionary/the#related-articles). *   [![Image 11](https://prod.cdn-mw.com/dist-cross-dungarees/2026-07-21--18-32-41-ahbhs/images/svg/sidebar-nav-item-icon.svg)Cite this Entry Citation](https://www.merriam-webster.com/dictionary/the#citations). *   [![Image 12](https://prod.cdn-mw.com/dist-cross-dungarees/2026-07-21--18-32-41-ahbhs/images/svg/sidebar-nav-item-icon.svg)Kids Definition Kids](https://www.merriam-webster.com/dictionary/the#kidsdictionary). *   To save this word, you'll need to log in.[Log In](https://www.merriam-webster.com/login). [See more words from the same century](https://www.merriam-webster.com/time-traveler/before-12th-century?src=defrecirc-timetraveler-etycard). [See all Nearby Words](https://www.merriam-webster.com/browse/dictionary/t/20). #### [Word of the Day](https://www.merriam-webster.com/word-of-the-day). #### [stalwart](https://www.merriam-webster.com/word-of-the-day). [See Definitions and Examples](https://www.merriam-webster.com/word-of-the-day) ». ### [Commonly Misspelled Words](https://www.merriam-webster.com/grammar/commonly-misspelled-words). ### [The Longest Long Words List](https://www.merriam-webster.com/wordplay/longest-words-ever). Each of your guesses must be a real 5-letter word.](https://prod.cdn-mw.com/assets/mw/static/images/games/external/quordle/485x364@1x.jpg) Quordle Can you solve 4 words at once?Play](https://www.merriam-webster.com/games/quordle/). [![Image 22: thumbnail graphic with text word of the day quiz](https://prod.cdn-mw.com/assets/mw/images/quiz/quiz-global-footer-recirc/thumbnail%20graphic%20with%20text%20word%20of%20the%20day%20quiz-13136-123ef0e665bcfd7a64300b42efcd4156@1x.jpg) Weekly ""Word of the Day"" Quiz See how well you know each Word of the Day for Ju...Take the quiz](https://www.merriam-webster.com/games/weekly-wotd-quiz-5). [Do not sell or share my personal information.](https://www.merriam-webster.com/).",unknown_date,web_result
2433630,"""The Left Behind"" gameplay",general,1,tavily,basic,3,https://www.timeshighereducation.com,Times Higher Education home | Times Higher Education (THE),"Daily news and analysis for global higher education](https://www.timeshighereducation.com/academic/news). The world’s most comprehensive university rankings](https://www.timeshighereducation.com/world-university-rankings). Advice and insight on teaching, research and academic careers from higher education professionals](https://www.timeshighereducation.com/campus). Connecting the higher education community to our global network](https://www.timeshighereducation.com/events). THE Student supports you, from first university search to your first day on campus](https://www.timeshighereducation.com/student). Higher education’s global job board](https://www.timeshighereducation.com/unijobs/). Services for universities, governments and corporates](https://www.timeshighereducation.com/our-solutions). News, jobs and services for US higher education](https://www.insidehighered.com/). [See all](https://www.timeshighereducation.com/news). [News](https://www.timeshighereducation.com/taxonomy/term/307). [News](https://www.timeshighereducation.com/taxonomy/term/307). [News](https://www.timeshighereducation.com/taxonomy/term/307). [News](https://www.timeshighereducation.com/taxonomy/term/307). [See all](https://www.timeshighereducation.com/world-university-rankings). [Sustainability Impact Ratings 2026](https://www.timeshighereducation.com/impactrankings). [World University Rankings 2026](https://www.timeshighereducation.com/world-university-rankings/latest/world-ranking). [Interdisciplinary Science Rankings 2026](https://www.timeshighereducation.com/world-university-rankings/interdisciplinary-science-rankings). [Arab University Rankings 2026](https://www.timeshighereducation.com/world-university-rankings/2026/arab-university-rankings). [Asia University Rankings 2026](https://www.timeshighereducation.com/world-university-rankings/2026/regional-ranking). [Participate in upcoming rankings](https://www.timeshighereducation.com/how-participate-times-higher-education-rankings). [See all](https://www.timeshighereducation.com/student/best-universities). [### Best universities in Toronto 2026](https://www.timeshighereducation.com/student/best-universities/best-universities-toronto). [### Digital Leaders: top universities for a digital education](https://www.timeshighereducation.com/student/best-universities/digital-leaders-top-universities-digital-education). [See all](https://www.timeshighereducation.com/unijobs/). 33 jobs available](https://www.timeshighereducation.com/unijobs/listings/africa/). 617 jobs available](https://www.timeshighereducation.com/unijobs/listings/asia/). 293 jobs available](https://www.timeshighereducation.com/unijobs/listings/europe/). 86 jobs available](https://www.timeshighereducation.com/unijobs/listings/middle-east/). 203 jobs available](https://www.timeshighereducation.com/unijobs/listings/oceania/). 0 jobs available](https://www.timeshighereducation.com/unijobs/listings/south-america/). 126 jobs available](https://www.timeshighereducation.com/unijobs/listings/united-kingdom/). [See all](https://www.timeshighereducation.com/campus). [Teaching and learning](https://www.timeshighereducation.com/campus/keywords/teaching-and-learning-0). [Teaching and learning](https://www.timeshighereducation.com/campus/keywords/teaching-and-learning-0). [Teaching and learning](https://www.timeshighereducation.com/campus/keywords/teaching-and-learning-0). [Early career research](https://www.timeshighereducation.com/campus/keywords/early-career-research-0).",unknown_date,web_result
2433630,"""The Left Behind"" gameplay",general,1,tavily,basic,3,https://uiowa.edu,The University of Iowa,"# [The University of Iowa](https://uiowa.edu/). *   [Visit](https://admissions.uiowa.edu/visit-campus ""Visit""). *   [Admissions](https://uiowa.edu/admissions). *   [Undergraduate Admissions](https://admissions.uiowa.edu/). *   [Graduate Admissions](https://grad.admissions.uiowa.edu/). *   [Academics](https://uiowa.edu/academics). *   [Colleges](https://uiowa.edu/academics/colleges). *   [Research](https://uiowa.edu/research). *   [Student Life](https://uiowa.edu/student-life). *   [Iowa City](https://uiowa.edu/student-life/iowa-city). *   [Living on Campus](https://uiowa.edu/student-life/living-campus). *   [About](https://uiowa.edu/about-iowa). *   [News](https://now.uiowa.edu/). *   [Events](https://events.uiowa.edu/). *   [Media Resources](https://osc.uiowa.edu/media). [Video 2](https://uiowa.edu/sites/uiowa.edu/files/2023-03/2023_03_06-Communication-264.mp4). [Read Campus News](https://now.uiowa.edu/)|[Read Featured Stories](https://stories.uiowa.edu/). ![Image 1: Iowa graduates in black robe and black caps throw them in the air](https://uiowa.edu/sites/uiowa.edu/files/styles/widescreen__1024_x_576/public/2026-06/2025_05_08-Cap-and-Gown-Commercial-Shoot-May-2025-jatorner-2647.jpg?h=26b29af5&itok=hNz_pgcX). ### [Celebrating Iowa’s spring 2026 grads](https://stories.uiowa.edu/spring-2026-graduation-infographic). ![Image 4: Student with Iowa shirt and holding a laptop talking to a woman who is the instructor in a black sweatshirt](https://uiowa.edu/sites/uiowa.edu/files/styles/square__1024_x_1024/public/2026-04/2018_04_10-CCCC-2220-FOUNDATIONS-CRITICAL-CULTURAL-COMPETENCE-jatorner-0265-medium.jpg?h=0eafbf7e&itok=eKB2ONIs). ![Image 5: Six students waving to stadium crowd and hospital](https://uiowa.edu/sites/uiowa.edu/files/styles/square__1024_x_1024/public/2026-02/2018_09_15-FB-UNI-vs-Iowa-jatorner-0468-medium_0.jpg?h=a81b533e&itok=pg_-VQIg). ![Image 6: Four students sitting on dock along the Iowa River.](https://uiowa.edu/sites/uiowa.edu/files/2026-02/students-sitting-dock-river-sunset_0.jpg). ![Image 7: Aerial view of east campus with Iowa River.](https://uiowa.edu/sites/uiowa.edu/files/styles/ultrawide__1312_x_562/public/2020-03/aerial-east-side-crew_0.jpg?h=14373735&itok=7vXoukLX). ## [Welcome Home](https://uiowa.edu/student-life/iowa-city). [The University of Iowa](https://uiowa.edu/). *   [Campus Map](https://maps.uiowa.edu/). *   [Campus Safety](https://uiowa.edu/student-life/safety-and-support). *   [Directory](https://iam.uiowa.edu/whitepages/search). *   [Free Speech at Iowa](https://freespeech.uiowa.edu/). *   [ICON](https://icon.uiowa.edu/). *   [Jobs@Iowa](https://jobs.uiowa.edu/). *   [Libraries](https://www.lib.uiowa.edu/). *   [MAUI](https://www.maui.uiowa.edu/). *   [Office365](https://office365.uiowa.edu/). *   [Student Health](https://studenthealth.uiowa.edu/). *   [Well-Being at Iowa](https://wellbeing.uiowa.edu/). *   [Accessibility](https://accessibility.uiowa.edu/).",unknown_date,web_result
2433630,"""The Left Behind"" gameplay",general,1,tavily,basic,3,https://en.wikipedia.org/wiki/The,The - Wikipedia,"It is the [definite article](//en.wikipedia.org/wiki/Definite_article ""Definite article"") in English. *The* is the [most frequently used word](//en.wikipedia.org/wiki/Most_common_words_in_English ""Most common words in English"") in the English language; studies and analyses of texts have found it to account for seven percent of all printed English-language words.[[1]](#cite_note-1) It is derived from gendered articles in [Old English](//en.wikipedia.org/wiki/Old_English ""Old English"") which combined in [Middle English](//en.wikipedia.org/wiki/Middle_English ""Middle English"") and now has a single form used with nouns of any gender.[[a]](#cite_note-2) The word can be used with both singular and plural nouns, and with a noun that starts with any letter or sound. Modern [American](//en.wikipedia.org/wiki/American_English ""American English"") and [New Zealand English](//en.wikipedia.org/wiki/New_Zealand_English ""New Zealand English"") have an increasing tendency to limit usage of /ðiː/ pronunciation and use /ðə/, even before a vowel.[[4]](#cite_note-6)[[5]](#cite_note-7). Definite article principles in English are described under ""[Use of articles](//en.wikipedia.org/wiki/English_articles#Use_of_articles ""English articles"")"". 2. [↑](#cite_ref-4) such as [French](//en.wikipedia.org/wiki/French_language ""French language""), which uses *le* for masculine singular, *la* for feminine singular, and *les* for plural. 4. [↑](#cite_ref-6) [Ladefoged, Peter](//en.wikipedia.org/wiki/Peter_Ladefoged ""Peter Ladefoged""); Johnson, Keith (2010).",unknown_date,web_result
